ticker,company,quality_score,valuation_score,balance_sheet_score,next_action,reason_for_action
VRTX,Vertex Pharmaceuticals Inc.,9,6,9,deep_dive,Un-analyzed monopoly franchise at reasonable price; high quality understandable strong balance sheet
REGN,Regeneron Pharmaceuticals Inc.,8,7,9,deep_dive,Un-analyzed high-quality biotech with durable franchise strong balance sheet and reasonable valuation
AMGN,Amgen Inc.,7,6,5,deep_dive,Un-analyzed large-cap biotech with obesity pipeline optionality; balance sheet risk needs proper assessment
NFLX,Netflix Inc.,8,6,7,deep_dive,Un-analyzed dominant platform at compressed multiple; proven pricing power and scale moat
GE,GE Aerospace,8,6,7,deep_dive,Un-analyzed aero engine monopoly with long-duration aftermarket revenue; strong FCF reasonable valuation
DE,Deere & Co.,7,6,6,deep_dive,Un-analyzed industrial compounder at cyclical trough; precision ag moat deepening potential entry opportunity
PANW,Palo Alto Networks Inc.,7,5,7,deep_dive,Un-analyzed cybersecurity platform leader; secular growth thesis with consolidation dynamics worth evaluating
BX,Blackstone Inc.,8,5,7,deep_dive,Un-analyzed alt asset compounder with durable AUM flywheel; fee-related earnings quality needs assessment
